type,chapter,progress1,progress2
text,There are two coalitions involved in the Plastics Treaty,0,0
text,The first is the High Ambition Coalition,0,0
text,"These countries haven't explicitly joined the HAC but, because the EU votes as a block, they are implicitly aligned with the HAC",0,0
text,The second is the Like Minded Group,0,0
text,If we count the number of countries in each group...,1,0
text,"However, if we look at population figures for each country, we get a different story",1,1
text,...and this should be step 6,1,1